{
  "schema_version": "1.0.0",
  "slice_id": "world-slice-leonardo-1502-1504-v1",
  "title": "Leonardo: documented movement and changing context, 1502–1504",
  "status": "SCOPE_FROZEN",
  "publication_status": "non_public_curation",
  "issue_refs": {
    "parent": 355,
    "delivery": 332,
    "paused_relation_gate": 331
  },
  "temporal_scope": {
    "start": "1502-01-01",
    "end": "1504-12-31",
    "boundary_kind": "analytical_closed_interval",
    "historical_precision_note": "The slice boundary is an analytical selection window. Candidate object dates retain their own day, month, year, range or unresolved precision."
  },
  "spatial_scope": {
    "focus": "central_italy",
    "focus_place_refs": [
      "place-imola",
      "place-florence"
    ],
    "global_context_policy": "Include only a small number of source-bound simultaneous contexts outside Italy; spatial-temporal overlap never implies contact or influence.",
    "historical_polygon": null
  },
  "layers": [
    {
      "layer_id": "layer-leonardo-trajectory",
      "label": "Leonardo trajectory",
      "role": "primary_trajectory"
    },
    {
      "layer_id": "layer-local-context",
      "label": "Central Italian events and states",
      "role": "local_context"
    },
    {
      "layer_id": "layer-cartographic-change",
      "label": "Documented cartographic activity and analytical coverage",
      "role": "change_context"
    },
    {
      "layer_id": "layer-global-simultaneity",
      "label": "Selected global simultaneity",
      "role": "global_context"
    }
  ],
  "selection_rules": {
    "include": [
      "Claims needed to explain Leonardo's documented presence, work state and selected change during 1502–1504",
      "One explicit unknown-route gap between independently source-bound presence endpoints",
      "One analytical Region whose candidate versions come from separately catalogued maps and remain geometry-withheld until review",
      "A sparse global context item with independent institutional evidence",
      "Only objects needed by a concrete synchronized Globe review task"
    ],
    "exclude": [
      "Exhaustive Leonardo biography or Renaissance survey",
      "Routes inferred from straight lines between known places",
      "Documented encounter, interaction, influence or causal predicates while issue #331 is paused",
      "Historical political boundaries digitized without declared map provenance and independent review",
      "Royal Collection images or other media without explicit reuse permission",
      "Objects selected only for visual density"
    ],
    "absence_rule": "Absence from this deliberately sparse World Slice never asserts historical absence."
  },
  "relation_policy": {
    "allowed_computed_observations": [
      "derived_co_presence"
    ],
    "prohibited_predicates": [
      "possible_encounter",
      "documented_encounter",
      "interaction",
      "influence",
      "causal"
    ],
    "stored_relations": []
  },
  "required_object_types": [
    "Entity",
    "Event",
    "State",
    "Process",
    "Trajectory",
    "Region"
  ],
  "candidate_objects": [
    {
      "object_id": "entity-leonardo-da-vinci",
      "object_type": "Entity",
      "label": "Leonardo da Vinci",
      "layer_refs": ["layer-leonardo-trajectory"],
      "curation_state": "candidate_not_ready",
      "source_refs": ["source-rct-imola-map"],
      "temporal_hint": {
        "value": "1452/1519",
        "precision": "range",
        "assertion_status": "candidate_requires_claim_binding"
      },
      "spatial_mode": "named_place",
      "geometry": null,
      "notes": "Primary Person candidate. Identity and lifespan still require atomic Claim/EvidenceLink records in the curated package."
    },
    {
      "object_id": "place-imola",
      "object_type": "Entity",
      "label": "Imola",
      "layer_refs": ["layer-local-context", "layer-cartographic-change"],
      "curation_state": "candidate_not_ready",
      "source_refs": ["source-getty-tgn-imola"],
      "temporal_hint": {
        "value": null,
        "precision": "pending",
        "assertion_status": "candidate_requires_claim_binding"
      },
      "spatial_mode": "approximate_point",
      "geometry": null,
      "notes": "Getty TGN coordinates are an approximate reference point only, not a historical footprint or exact Leonardo location."
    },
    {
      "object_id": "place-florence",
      "object_type": "Entity",
      "label": "Florence",
      "layer_refs": ["layer-local-context", "layer-leonardo-trajectory"],
      "curation_state": "candidate_not_ready",
      "source_refs": ["source-getty-tgn-florence"],
      "temporal_hint": {
        "value": null,
        "precision": "pending",
        "assertion_status": "candidate_requires_claim_binding"
      },
      "spatial_mode": "approximate_point",
      "geometry": null,
      "notes": "Getty TGN coordinates are an approximate reference point only, not a historical city boundary."
    },
    {
      "object_id": "event-leonardo-borgia-appointment",
      "object_type": "Event",
      "label": "Leonardo appointed General Architect and Engineer to Cesare Borgia",
      "layer_refs": ["layer-local-context", "layer-leonardo-trajectory"],
      "curation_state": "candidate_not_ready",
      "source_refs": ["source-rct-imola-map"],
      "temporal_hint": {
        "value": "1502-08",
        "precision": "month",
        "assertion_status": "candidate_requires_claim_binding"
      },
      "spatial_mode": "named_place",
      "geometry": null,
      "notes": "The institutional catalogue supports month precision; no day or appointment-place geometry is asserted."
    },
    {
      "object_id": "event-battle-of-anghiari-commission",
      "object_type": "Event",
      "label": "Leonardo receives the Battle of Anghiari commission",
      "layer_refs": ["layer-local-context", "layer-leonardo-trajectory"],
      "curation_state": "candidate_not_ready",
      "source_refs": ["source-ng-procession-calvary"],
      "temporal_hint": {
        "value": "1503-10",
        "precision": "month",
        "assertion_status": "candidate_requires_claim_binding"
      },
      "spatial_mode": "named_place",
      "geometry": null,
      "notes": "The October 1503 commission and 4 May 1504 formal contract must become separate atomic Claims."
    },
    {
      "object_id": "state-leonardo-in-borgia-service",
      "object_type": "State",
      "label": "Leonardo in the service of Cesare Borgia",
      "layer_refs": ["layer-local-context", "layer-cartographic-change"],
      "curation_state": "candidate_not_ready",
      "source_refs": ["source-rct-imola-map", "source-rct-southern-tuscany-map"],
      "temporal_hint": {
        "value": "1502/1503",
        "precision": "range",
        "assertion_status": "candidate_requires_claim_binding"
      },
      "spatial_mode": "named_place",
      "geometry": null,
      "notes": "This is a work/service State, not a Relation between Leonardo and Borgia and not a claim of personal encounter."
    },
    {
      "object_id": "state-imola-papal-context",
      "object_type": "State",
      "label": "Imola in the direct papal-domination context after 1499",
      "layer_refs": ["layer-local-context"],
      "curation_state": "candidate_not_ready",
      "source_refs": ["source-imola-civic-museums-rocca"],
      "temporal_hint": {
        "value": "1503",
        "precision": "year",
        "assertion_status": "candidate_requires_claim_binding"
      },
      "spatial_mode": "named_place",
      "geometry": null,
      "notes": "Regional political context candidate from the civic museum account; exact State validity and any boundary remain pending atomic Claim review."
    },
    {
      "object_id": "process-leonardo-cartographic-service",
      "object_type": "Process",
      "label": "Leonardo's documented cartographic and engineering activity in Borgia service",
      "layer_refs": ["layer-cartographic-change"],
      "curation_state": "candidate_not_ready",
      "source_refs": ["source-rct-imola-map", "source-rct-southern-tuscany-map", "source-imola-civic-museums-rocca"],
      "temporal_hint": {
        "value": "1502/1503",
        "precision": "range",
        "assertion_status": "candidate_requires_claim_binding"
      },
      "spatial_mode": "named_place",
      "geometry": null,
      "notes": "The Process may expose source-bound stages, but it must not invent travel order, military mechanism or continuous coverage."
    },
    {
      "object_id": "trajectory-leonardo-imola-florence",
      "object_type": "Trajectory",
      "label": "Leonardo from documented Imola context to documented Florence work context",
      "layer_refs": ["layer-leonardo-trajectory"],
      "curation_state": "candidate_not_ready",
      "source_refs": ["source-rct-imola-map", "source-imola-civic-museums-rocca", "source-ng-procession-calvary"],
      "temporal_hint": {
        "value": "1502/1504",
        "precision": "range",
        "assertion_status": "candidate_requires_claim_binding"
      },
      "spatial_mode": "unknown_route",
      "geometry": null,
      "notes": "Two candidate presence contexts are separated by an explicit inferred gap. No connecting line is permitted.",
      "segments": [
        {
          "segment_id": "segment-imola-presence",
          "segment_kind": "presence",
          "place_ref": "place-imola",
          "spatial_mode": "named_place",
          "geometry": null,
          "source_refs": ["source-rct-imola-map", "source-imola-civic-museums-rocca"]
        },
        {
          "segment_id": "segment-imola-florence-gap",
          "segment_kind": "inferred_gap",
          "place_ref": null,
          "spatial_mode": "unknown_route",
          "geometry": null,
          "source_refs": []
        },
        {
          "segment_id": "segment-florence-work-context",
          "segment_kind": "presence",
          "place_ref": "place-florence",